text,category,set,category_id,id
"I got a transfer fail message, but no explanation of why-- what happened?",failed_transfer,train,57,7469
Why did the transfer fail when I attempted to do it earlier?,failed_transfer,train,57,7470
"Hello.  I ran into a problem with a transfer this morning.  I was trying to send money to some friends but when I tried to send it, the transfer failed.  I don't know what is causing the transfer to be rejected.  Please let me know what is causing the problem.  Thanks.",failed_transfer,train,57,7471
"So, I am in the middle of purchasing a flat. I need the money for the first mortgage payment and it is not going through. I keep receiving an error. Can you find out what's going on and help me complete this transfer?",failed_transfer,train,57,7472
Can you tell my why my funds transfer did not work properly?,failed_transfer,train,57,7473
Why didn't my transfer work?,failed_transfer,train,57,7474
"Hi there, I've tried to make a transfer 5 different times and its not working. Is your system down or something?",failed_transfer,train,57,7475
Why can I not make a transfer?,failed_transfer,train,57,7476
"My transfer failed, why did that happen?",failed_transfer,train,57,7477
The app says my transfer failed,failed_transfer,train,57,7478
Is there a reason my transfer failed?,failed_transfer,train,57,7479
Why was my transaction not approved?,failed_transfer,train,57,7480
I attemped a transfer and it didn't go through.,failed_transfer,train,57,7481
is the a reason why my transfer has failed?,failed_transfer,train,57,7482
The transfer I tried to make failed.,failed_transfer,train,57,7483
Can you please assist me in completing a transfer? I'm trying and I keep getting an error. I'm trying to purchase a flat and pay the initial mortgage payment. All I keep getting is an error. Can you find out what's happening here?,failed_transfer,train,57,7484
"Why can't I transfer my money into someone else's account? I should be able to do so right? Why does it keep rejecting my transfer? There's no reason, all my info is correct and the money is there.",failed_transfer,train,57,7485
"Hello, I am buying a flat and need the inital payment for the mortgage to go through. It keeps showing up as error, what is going on? Can you please help me make this transfer?",failed_transfer,train,57,7486
Why can't I complete my transfer?,failed_transfer,train,57,7487
"My card couldn't complete a transfer, why?",failed_transfer,train,57,7488
"Hey, I'm buying a flat and I need my mortgage to go though. However, every time I check I get an error message. Is there any way you can help me with this transfer.",failed_transfer,train,57,7489
"Errors keep showing up every time I try to make this transfer and I am on a time crunch,  could you please help.",failed_transfer,train,57,7490
Why do my transfers keep failing?,failed_transfer,train,57,7491
Why didn't this transfer work?,failed_transfer,train,57,7492
"Hi, I have been transferring money to my friends since morning, but all my transactions were getting failed. Can you please look into this issue.",failed_transfer,train,57,7493
"My transfer did not work, what was the reason?",failed_transfer,train,57,7494
What do I need to do to correct this failed transfer?,failed_transfer,train,57,7495
I tried to do a transfer and it hasn't worked!,failed_transfer,train,57,7496
What went wrong when I tried to do my transfer?,failed_transfer,train,57,7497
Why does it say my transfer failed?,failed_transfer,train,57,7498
I don't think my transfer wen through. Why?,failed_transfer,train,57,7499
How can I find out why my transfer didn't go through?,failed_transfer,train,57,7500
"I needed to send my friends some money urgently.  I tried multiple times to transfer the money this morning, but the transfer keeps failing.  Can you tell me why the transfer is getting rejected?",failed_transfer,train,57,7501
I tried to make a transfer and it failed.,failed_transfer,train,57,7502
"After I attempted a transfer, it failed.",failed_transfer,train,57,7503
I couldnt transfer money from my account.,failed_transfer,train,57,7504
"What stopped my transfer, from being accepted?",failed_transfer,train,57,7505
I've already tried 5 times to complete a transfer that's just standard. What's the deal? Is your system down at this time?,failed_transfer,train,57,7506
What caused my transfer to fail?,failed_transfer,train,57,7507
My transfer failed,failed_transfer,train,57,7508
"I tried to make a transfer, but it didn't work.",failed_transfer,train,57,7509
How is this transfer supposed to work? It's not working for me.,failed_transfer,train,57,7510
"This morning, I tried to send money to my friends several times but each time the transfer fails.  Why does it keep failing?  The transfer gets rejected but I do not know what is causing it to be rejected.",failed_transfer,train,57,7511
I'm trying to purchase a flat but i need my first payment for my mortgage to go through first. I keep getting an error. I'm not sure what is going on but i need help making this transfer.,failed_transfer,train,57,7512
"My transfer failed, why?",failed_transfer,train,57,7513
My transfer is failing when I try to do it.,failed_transfer,train,57,7514
I can't seem to make a standard bank transfer. I have tried at least five times already but none of them are going through. Please tell me what is wrong?,failed_transfer,train,57,7515
What may be the reason that my transfer did not go through?,failed_transfer,train,57,7516
I tried to transfer money but it didn't go through,failed_transfer,train,57,7517
My transfer didn't complete. Why can't I access funds?,failed_transfer,train,57,7518
Been trying to transfer money this morning but keep getting rejected. I don't understand why this is happening.,failed_transfer,train,57,7519
"Hi, I'm trying to purchase a flat and I'm needing the first payment for the mortgage to go through on the flat I'm trying to buy. For some reason I keep getting an error.can you assist in making this transfer? What is going on?",failed_transfer,train,57,7520
My transfer didn't work how come?,failed_transfer,train,57,7521
Hi I'm sending some money over to an investment bank I do business and the transaction is being rejected. I'm not sure why as I think I have the right details.,failed_transfer,train,57,7522
I think my transfer failed. What do I do now?,failed_transfer,train,57,7523
"I attempted a transfer, but it failed.",failed_transfer,train,57,7524
I couldn't make a transfer,failed_transfer,train,57,7525
Hello. I'm trying to transfer some money to a friend but it keeps getting rejected. can you help me?,failed_transfer,train,57,7526
"The transfer keeps rejected, I tried to transfer some money to friends but it keeps getting rejected for some reason, Would you please check the issue?",failed_transfer,train,57,7527
I've been trying to make a transfer and it doesn't seem to be working. (5 times) What is wrong with your system?,failed_transfer,train,57,7528
Why are my transfers not going through.  I have tried over 4 times to get it to work.  This is just a simple transfer.  Is something else causing this in the system?  Is it broken?,failed_transfer,train,57,7529
Why was I not able to complete my transfer?,failed_transfer,train,57,7530
"The transfer keeps failing , I tried to transfer some money to friends this morning but it keeps getting rejected for some reason, Would you please check the issue?",failed_transfer,train,57,7531
Why was my transaction declined?,failed_transfer,train,57,7532
Why wouldn't a transfer go through?,failed_transfer,train,57,7533
Can you please tell me why my transfer failed?,failed_transfer,train,57,7534
I did a transfer earlier but see that it failed to go through.,failed_transfer,train,57,7535
Why has my payment not transferred?,failed_transfer,train,57,7536
I tried to do a transfer but it didn't go through.,failed_transfer,train,57,7537
The attempted transfer failed.,failed_transfer,train,57,7538
I need help making this transfer. I keep getting an error. I'm trying to purchase a flat but i need my mortgage payment to go through first. Can you help?,failed_transfer,train,57,7539
Why does my transfer keep failing? I've tried 5 times and they all failed.,failed_transfer,train,57,7540
A mortgage payment I'm making is giving me an error message.  This is the first time I'm making this payment and want to know what's wrong.,failed_transfer,train,57,7541
"Hi, can you tell me why my transfer keeps being rejected? I've been trying to send money to my friends this morning but failed every time and I have no idea why?",failed_transfer,train,57,7542
I need assistance completing a transfer. I'm trying to purchase a flat and need the money for the initial mortgage payment. I keep getting an error and the transfer is not going through. What is going on here?,failed_transfer,train,57,7543
What are the reasons that my mortgage payment won't go through? I'm getting an error and don't know how to correct to get this transfer to go through.,failed_transfer,train,57,7544
Why was I unable to complete my transfer?,failed_transfer,train,57,7545
"Hi, I'm buying my son Bertie a starter home in London.  I'm just trying to send the 5% deposit over to the agent. It's only 200,000 but seems to be throwing an error.  What is going on?  If I wait any longer the house prices might rise, can you look in to it please?",failed_transfer,train,57,7546
I'm trying to make a bank transfer but It's not going through. Could there not be enough funds to transfer or something? Have I done it too many times?,failed_transfer,train,57,7547
I need to know what is going on. I'm attempting to purchase a flat and need the money to pay on my initial mortgage payment. I'm only getting an error. Can you find out what's going on and help in making the transfer?,failed_transfer,train,57,7548
Can you please explain why my transfer failed?,failed_transfer,train,57,7549
I think youre system may be broken because I have tried transfer money 5x and it isnt working!  I'm not doing anything complicated it is what I usually do.,failed_transfer,train,57,7550
I am trying to transfer money and something is going wrong.,failed_transfer,train,57,7551
I am unsuccessfully trying to make a transfer can you help?,failed_transfer,train,57,7552
"I can't transfer any money from my account to my friend's account, it keeps rejecting it. Can you tell me why? I have enough funds in my account to transfer.",failed_transfer,train,57,7553
Why did the bank reject my transfer?,failed_transfer,train,57,7554
"I tried and tried, but I could not complete my transfer. Tell me what is wrong.",failed_transfer,train,57,7555
I'm getting an error when trying to make a payment. I want to purchase a flat but my mortgage payment needs to go through. Can you help me?,failed_transfer,train,57,7556
The transger I tried to make failed.,failed_transfer,train,57,7557
"When I tried to transfer funds to my friend today I was unable to do so, why?",failed_transfer,train,57,7558
"I've tried to send money to my friends and I keep getting rejected. Can you please tell me why, I don't understand.",failed_transfer,train,57,7559
why do i have a failed transfer,failed_transfer,train,57,7560
I've tried completing a very standard transfer and have already attempted it 5 times. What's going on here? Is there a problem with your system?,failed_transfer,train,57,7561
"When I attempted to make a transfer, it failed.",failed_transfer,train,57,7562
Why can't my transfer complete?,failed_transfer,train,57,7563
Why can't I complete the transfer?,failed_transfer,train,57,7564
I want to transfer money. How do I do that for my account?,transfer_into_account,train,58,7565
How do I transfer money into my account?,transfer_into_account,train,58,7566
How can I link my bank to my top up account?,transfer_into_account,train,58,7567
I have an account that is empty of funds. Can I transfer some from another bank?,transfer_into_account,train,58,7568
HOW DO I TRANSFER MONEY FROM MY BANK ACCOUNT?,transfer_into_account,train,58,7569
Whats the transfer process,transfer_into_account,train,58,7570
How can you assist me on topping up on bank transfers to my account?,transfer_into_account,train,58,7571
Can I add money to my account via bank transfer?,transfer_into_account,train,58,7572
I want to op up my account by using bank transfer. How do I go about it?,transfer_into_account,train,58,7573
I have questions about how to transfer money to my account.,transfer_into_account,train,58,7574
I need to add money to my account. Can I do so via bank transfer?,transfer_into_account,train,58,7575
Can I use my bank account to send me more money?,transfer_into_account,train,58,7576
I can't figure out how to transfer money into my account.,transfer_into_account,train,58,7577
Can you please explain how to transfer money using the bank transfer process?,transfer_into_account,train,58,7578
How simple is it to transfer money into my account?,transfer_into_account,train,58,7579
How can my account have money transferred into it?,transfer_into_account,train,58,7580
"I am in desperate need to transfer funds from another account that i have into this one, how do i do that?",transfer_into_account,train,58,7581
How do I use bank transfer to top up my account?,transfer_into_account,train,58,7582
How do I top up?,transfer_into_account,train,58,7583
Why can I not transfer money into my account?,transfer_into_account,train,58,7584
How can I move money from an account at another bank to this one?,transfer_into_account,train,58,7585
What process should I use to transfer money into my account?,transfer_into_account,train,58,7586
"I want to transfer money into my account, what do I do?",transfer_into_account,train,58,7587
I need to deposit money to my account,transfer_into_account,train,58,7588
Can you transfer money to your card by bank transfer?,transfer_into_account,train,58,7589
What do you do to transfer money to my account?,transfer_into_account,train,58,7590
How can I move money from my account at a different bank to the account I have at this bank.,transfer_into_account,train,58,7591
Please provide details on how to top up my account using transfer option,transfer_into_account,train,58,7592
Where can I find out how to transfer money into my account.,transfer_into_account,train,58,7593
How does it work when I transfer money into my account?,transfer_into_account,train,58,7594
I need assistance with transferring funds to another account.,transfer_into_account,train,58,7595
How can I add money to my account from another account I have?,transfer_into_account,train,58,7596
I have money in a foreign account that I want to send to this account.,transfer_into_account,train,58,7597
How can I transfer money into my account?,transfer_into_account,train,58,7598
I need to move money from another bank to this account.,transfer_into_account,train,58,7599
I need to transfer money into this account from my other bank account.,transfer_into_account,train,58,7600
How do I go forth with bank transfers for top up accounts?,transfer_into_account,train,58,7601
"I have an account at another bank, but I want to transfer some of the money to my account here.
.",transfer_into_account,train,58,7602
"I want to do a bank transfer to this bank, from an account at another bank.",transfer_into_account,train,58,7603
What are my bank details so I can do a transfer?,transfer_into_account,train,58,7604
How would I use a bank transfer for topping my account?,transfer_into_account,train,58,7605
I would like to know how to transfer money into my account.,transfer_into_account,train,58,7606
My account is devoid of funds. Am I permitted to submit additional money via bank transfer?,transfer_into_account,train,58,7607
How does a bank transfer for topping my account work?,transfer_into_account,train,58,7608
I'd like to know how transferring my money into my account works.,transfer_into_account,train,58,7609
How is my money transferred to the account,transfer_into_account,train,58,7610
How do I top up my account with a bank transfer?,transfer_into_account,train,58,7611
I need to transfer money to my account from another bank,transfer_into_account,train,58,7612
I would like to transfer money into my account.,transfer_into_account,train,58,7613
I would like to transfer money from my checking account to my savings account.,transfer_into_account,train,58,7614
I want to transfer money into my account,transfer_into_account,train,58,7615
What transfer methods do you accept?,transfer_into_account,train,58,7616
"I need to transfer money into my account, and I don't know how to do that.",transfer_into_account,train,58,7617
"I need to transfer money into my account, HOW?",transfer_into_account,train,58,7618
Can I transfer money to my card via bank-transfer?,transfer_into_account,train,58,7619
How can I transfer some money into a foreign account?,transfer_into_account,train,58,7620
I need to know the process to transfer money into my account.,transfer_into_account,train,58,7621
Can I add money to top up my account via a bank transfer?,transfer_into_account,train,58,7622
What currencies can I use to top up my account?,transfer_into_account,train,58,7623
How do I top up my account using transfer?,transfer_into_account,train,58,7624
Account topping up bank transfers to my account assistance please?,transfer_into_account,train,58,7625
I want to take some funds from my other bank account and add them to this one.,transfer_into_account,train,58,7626
I need more money in my account. Can I add more by transferring?,transfer_into_account,train,58,7627
How do I go about transferring money into my bank account?,transfer_into_account,train,58,7628
How do I go forth on transferring a sum of money from one account to another?,transfer_into_account,train,58,7629
How do I initiated a bank transfer to top up?,transfer_into_account,train,58,7630
How can I transfer money between accounts?,transfer_into_account,train,58,7631
Whats the process of tranfering money into an account?,transfer_into_account,train,58,7632
"I would like to top up my account with a bank transfer, is that allowed?",transfer_into_account,train,58,7633
How can I deposit money to my account?,transfer_into_account,train,58,7634
I have zero dollars in my account. Can I submit additional funds via bank transfer?,transfer_into_account,train,58,7635
What are the steps for  making a transfer for topping up?,transfer_into_account,train,58,7636
"For my account, how do I transfer money in?",transfer_into_account,train,58,7637
How do I transfer money between two of my accounts?,transfer_into_account,train,58,7638
What is the procedure to transfer money to my account?,transfer_into_account,train,58,7639
Is a bank transfer acceptable for topping up my account?,transfer_into_account,train,58,7640
I have no more money in my account.  Is there a way to do a bank transfer to put money into my account?,transfer_into_account,train,58,7641
I need to transfer funds from my other bank account into this bank account.,transfer_into_account,train,58,7642
I want to transfer a sum of money from another bank account I have into this one,transfer_into_account,train,58,7643
Can I transfer money to my account with the app?,transfer_into_account,train,58,7644
Can you tell me how transferring money into my account works?,transfer_into_account,train,58,7645
Help! My account doesn't show any funds. Is transferring funds an option I can use?,transfer_into_account,train,58,7646
How do I transfer cash my into my account?,transfer_into_account,train,58,7647
How can I top up my account by bank transfer?,transfer_into_account,train,58,7648
I was wondering about transferring money into my account and how it works.  Can you tell me about that?,transfer_into_account,train,58,7649
My money is all gone. What ways are okay to add money to my account?,transfer_into_account,train,58,7650
I need to move money from one of my other accounts to this one.,transfer_into_account,train,58,7651
What is the process for transferring money into my account?,transfer_into_account,train,58,7652
Tell me how to top up my account using bank transfer.,transfer_into_account,train,58,7653
Can I top-up my card using a bank transfer.,transfer_into_account,train,58,7654
Can I use a bank transfer to add money to my account?,transfer_into_account,train,58,7655
"I want to top up by transfering accounts, What do I do?",transfer_into_account,train,58,7656
show me how to transfer to my account,transfer_into_account,train,58,7657
How does your app transfer the money,transfer_into_account,train,58,7658
How do I deposit through bank transfer?,transfer_into_account,train,58,7659
My account is depleted. Can I transfer funds from another bank?,transfer_into_account,train,58,7660
Can you please explain the topping up transfer process?,transfer_into_account,train,58,7661
What can I expect if I use bank transfer to top up my account?,transfer_into_account,train,58,7662
I want to transfer some money from my other bank account into this one.,transfer_into_account,train,58,7663
I want to transfer money from another account into this one.,transfer_into_account,train,58,7664
I would like to move money from one account to another to top off my account. Can you explain how I can do that?,transfer_into_account,train,58,7665
Can I withdraw money from another bank and transfer it into my empty account?,transfer_into_account,train,58,7666
How can I go about transferring money to my account?,transfer_into_account,train,58,7667
How can I transfer money to this account from another bank?,transfer_into_account,train,58,7668
can i transfer money i the app,transfer_into_account,train,58,7669
How do I transfer money from one bank account to another?,transfer_into_account,train,58,7670
What steps are taken to transfer money into my account?,transfer_into_account,train,58,7671
I am out of money in my account and I was wondering if I could do a bank transfer is put more in it?,transfer_into_account,train,58,7672
Can you please explain how bank transfers work?,transfer_into_account,train,58,7673
Can you help me transfer funds from another bank account to this account?,transfer_into_account,train,58,7674
I am looking to transfer some money from my other bank account into this one.,transfer_into_account,train,58,7675
where do i go to transfer money from one account to this one,transfer_into_account,train,58,7676
I need money put into this account from another one.,transfer_into_account,train,58,7677
Do you know how I can verify that I did a top-up to my card?,verify_top_up,train,59,7678
where is the code for verifying the top up card?,verify_top_up,train,59,7679
The top-up card is verified how?,verify_top_up,train,59,7680
Tell me about verifying top-up,verify_top_up,train,59,7681
What is the verification code for my top up card?,verify_top_up,train,59,7682
Explain to me how to verify the top-up card.,verify_top_up,train,59,7683
How can I verify my top-up card?,verify_top_up,train,59,7684
Can you show me how to verify the top-up card?,verify_top_up,train,59,7685
Can you explain to me the way to verify my top up has gone through?,verify_top_up,train,59,7686
I can't find the top-up card verification code.,verify_top_up,train,59,7687
I would like to receive instructions showing the verification process for top up cards..,verify_top_up,train,59,7688
Where is the top-up verification code located?,verify_top_up,train,59,7689
For what reason must I authenticate the top up?,verify_top_up,train,59,7690
what's my top-up verification code?,verify_top_up,train,59,7691
Why do the top-ups need to be verified?,verify_top_up,train,59,7692
Does the top-up need verified?,verify_top_up,train,59,7693
I am having trouble finding the top-up card verification code.,verify_top_up,train,59,7694
Why do you ask for top-up verification?,verify_top_up,train,59,7695
Where can I find the top up verification code?,verify_top_up,train,59,7696
How is top-up verified?,verify_top_up,train,59,7697
Do I need to verify my top-up card?,verify_top_up,train,59,7698
How do i verify my card?,verify_top_up,train,59,7699
What is the point of verifying a top up?,verify_top_up,train,59,7700
How do I verify my top up?,verify_top_up,train,59,7701
How do I find the top-up verification code?,verify_top_up,train,59,7702
Why does top-up need to be verified?,verify_top_up,train,59,7703
why do i have to verify top up?,verify_top_up,train,59,7704
"I'm trying to verify my top-up card, but I can't find the code...?",verify_top_up,train,59,7705
How can I verify the top-up card?,verify_top_up,train,59,7706
how do I find the code to verify the top up card?,verify_top_up,train,59,7707
I need to find the top up verification code,verify_top_up,train,59,7708
Please help me find my top-up verification code,verify_top_up,train,59,7709
Where can I find the verification code for the card top-up?,verify_top_up,train,59,7710
Do I need to verify my top-up?,verify_top_up,train,59,7711
Why do we need to verify a top-up card?,verify_top_up,train,59,7712
I have a top up card. Where is the verification code?,verify_top_up,train,59,7713
How do I find the code needed in order to verify my top-up card?,verify_top_up,train,59,7714
How do i find my top-up card's verification code?,verify_top_up,train,59,7715
How do I verify the top-up?,verify_top_up,train,59,7716
How many digits identify the top-up verification code?,verify_top_up,train,59,7717
What is the significance of verifying the top-up?,verify_top_up,train,59,7718
Why do we need to verify top-up?,verify_top_up,train,59,7719
Please verify my top-up card,verify_top_up,train,59,7720
Is there a reason why top-up needs verifying?,verify_top_up,train,59,7721
I don't know where the top-up verification code is.,verify_top_up,train,59,7722
Verifying the top-up seems like a hassle.,verify_top_up,train,59,7723
I can't see a verification code anywhere,verify_top_up,train,59,7724
Verify top-up card help?,verify_top_up,train,59,7725
What do I do to verify a top-up?,verify_top_up,train,59,7726
