text,category,set,category_id,id
An extra fee has been added to my card payment is this correct?,card_payment_fee_charged,train,20,2588
Why was there an extra charge because I used my card to pay?,card_payment_fee_charged,train,20,2589
Why do I have to pay extra for using my card?,card_payment_fee_charged,train,20,2590
"Unbeknownst to me, there was an additional charge on my prior transaction. A notification of sorts should be required and explained before future payments are made.",card_payment_fee_charged,train,20,2591
I paid with my card and was charged extra,card_payment_fee_charged,train,20,2592
My account was charged a fee. When did you start charging extra for card payments?,card_payment_fee_charged,train,20,2593
Explain the extra fee on my card when paying.,card_payment_fee_charged,train,20,2594
I was charged and shouldn't have been charged when using my card!,card_payment_fee_charged,train,20,2595
I have a fee and I don't know why,card_payment_fee_charged,train,20,2596
I was mistakenly charged a fee for using my card.,card_payment_fee_charged,train,20,2597
tell me why I was charged more with my card?,card_payment_fee_charged,train,20,2598
"My card is showing a fee from when I used it, but I thought this card was supposed to be fee free?",card_payment_fee_charged,train,20,2599
There was an extra fee when I paid with the card.,card_payment_fee_charged,train,20,2600
I think I was wrongly charged in a recent transaction when I used my card.,card_payment_fee_charged,train,20,2601
"I have been charged a fee, I didn't know about this fee before! When do you charge extra for card payments?",card_payment_fee_charged,train,20,2602
I was spending cash with my card and got a fee.,card_payment_fee_charged,train,20,2603
What are these fees i am paying?,card_payment_fee_charged,train,20,2604
Why have I been charged a fee for card payment?,card_payment_fee_charged,train,20,2605
How come I was charged an extra fee when paying with the card?,card_payment_fee_charged,train,20,2606
Why is there a charged fee for debit or credit card payment?,card_payment_fee_charged,train,20,2607
Am I getting charged for making a payment?,card_payment_fee_charged,train,20,2608
Why do some of my payments have fees?  I don't understand.,card_payment_fee_charged,train,20,2609
Why did I have to pay an additional amount when using my card to pay?,card_payment_fee_charged,train,20,2610
I paid with my card and I was charged a fee,card_payment_fee_charged,train,20,2611
There was a charge applied when I used my card.,card_payment_fee_charged,train,20,2612
I was charged a hidden fee when I paid with card.,card_payment_fee_charged,train,20,2613
Why does it cost more to pay with my card?,card_payment_fee_charged,train,20,2614
Is there a place to check for fee for payments? I feel like I'm getting charged too much at times.,card_payment_fee_charged,train,20,2615
I need to be made aware when I am being charged an extra amount for payments please. I looked over the app earlier and noticed an additional feel related to one of the payments. I was not warned about this before.,card_payment_fee_charged,train,20,2616
Why was I charged extra when paying with card?,card_payment_fee_charged,train,20,2617
Why am I charged a fee when using my debit or credit card?,card_payment_fee_charged,train,20,2618
"I am getting charged fees on some payments.  Please help me understand, where are these fees disclosed?",card_payment_fee_charged,train,20,2619
Why was the price higher when I paid with my card?,card_payment_fee_charged,train,20,2620
I just made an order and noticed an extra fee. Why have you charged me this without informing me?,card_payment_fee_charged,train,20,2621
I didn't know I was going to get charged to use my card.,card_payment_fee_charged,train,20,2622
I have been charged an extra fee when buying from your store. Why is this?,card_payment_fee_charged,train,20,2623
What is this extra fee that I got when I used my card to pay?,card_payment_fee_charged,train,20,2624
Was I charged extra for using my card?,card_payment_fee_charged,train,20,2625
Let me know when applying extra charges for payments. I just checked the app and saw a fee that I wasn't warned about.,card_payment_fee_charged,train,20,2626
Why was I charged an additional fee when paying with card?,card_payment_fee_charged,train,20,2627
Why did I get charged extra?,card_payment_fee_charged,train,20,2628
I paid with card and I was charged a fee,card_payment_fee_charged,train,20,2629
I made a purchase but never expected to see a fee charged for the transaction.,card_payment_fee_charged,train,20,2630
I was charged for using my card?,card_payment_fee_charged,train,20,2631
My card was charged more than expected.,card_payment_fee_charged,train,20,2632
Where can I check to see if there will be a fee added to my payment? Are there specific instances that will result in a fee added?,card_payment_fee_charged,train,20,2633
Why have i been charged a fee for using my card?,card_payment_fee_charged,train,20,2634
Why was I charged extra using my card?,card_payment_fee_charged,train,20,2635
How was I charged extra when I used my card to pay?,card_payment_fee_charged,train,20,2636
When do i get charged a fee for using the card?,card_payment_fee_charged,train,20,2637
"I see I was charged extra when I used the card.  I am not sure why, please tell me why.",card_payment_fee_charged,train,20,2638
Why was I charged a fee for my card payment?,card_payment_fee_charged,train,20,2639
Why was I charged an extra fee when using the card?,card_payment_fee_charged,train,20,2640
Let me know when you charge for payments. I just checked the app and saw a fee that I wasn't warned about.,card_payment_fee_charged,train,20,2641
What is the charge for paying with my card?,card_payment_fee_charged,train,20,2642
I paid with my card and ended up being charged a fee.,card_payment_fee_charged,train,20,2643
Why is there a fee on a card payment?,card_payment_fee_charged,train,20,2644
I was unaware of the additional charge that was added onto my previous payment. A notification of extra charges would be appreciated in the future.,card_payment_fee_charged,train,20,2645
I don't think I should have been charged a fee to use my card.,card_payment_fee_charged,train,20,2646
A fee that shouldn't be there is there after using my card!,card_payment_fee_charged,train,20,2647
"How do I see what fees I am supposed to be charged on my account? I've noticed fees on some transactions, but not on others. This is very confusing and I cannot find a pattern to what I am being charged?",card_payment_fee_charged,train,20,2648
Why am I getting charged more for using my card?,card_payment_fee_charged,train,20,2649
I see a fee that I think was charged because I paid by card.,card_payment_fee_charged,train,20,2650
What are the fees imposed when I make a transaction?,card_payment_fee_charged,train,20,2651
What was the extra charge for using my card?,card_payment_fee_charged,train,20,2652
Why was a fee added to my bill when I used my card?,card_payment_fee_charged,train,20,2653
Please tell my why I was charged a fee for using my card?,card_payment_fee_charged,train,20,2654
How can I check how much free spending I have left? I have some big purchases coming up and want to know where I can look for any info.,card_payment_fee_charged,train,20,2655
I was charged a fee when buying stuff with my card.,card_payment_fee_charged,train,20,2656
I was charged an additional amount of money for making a purchase with my card,card_payment_fee_charged,train,20,2657
What is the fee charged for using my card?,card_payment_fee_charged,train,20,2658
I just saw a fee on my account. When do these get charged?,card_payment_fee_charged,train,20,2659
Is it normal to get charged extra when i use my card?,card_payment_fee_charged,train,20,2660
This fee shouldn't be there after I paid with a card.,card_payment_fee_charged,train,20,2661
Why am I charged an extra fee on my card?,card_payment_fee_charged,train,20,2662
Why did I get charged more for using my card?,card_payment_fee_charged,train,20,2663
I recently bought an item using my card and I was charged an extra fee why is this?,card_payment_fee_charged,train,20,2664
I am angry that I got charged for using my card.,card_payment_fee_charged,train,20,2665
I wanted to know why i got an additional fee when i use my card.,card_payment_fee_charged,train,20,2666
"Is there a fee for making a payment? If so, let me know why.",card_payment_fee_charged,train,20,2667
Please tell me why I would have to pay a fee for a recent payment. Thanks.,card_payment_fee_charged,train,20,2668
Why was I charged a fee for debit or credit card payment?,card_payment_fee_charged,train,20,2669
Why was an extra charge added when I used my card?,card_payment_fee_charged,train,20,2670
Why have I been charged a small fee to use my card?,card_payment_fee_charged,train,20,2671
I was charged an extra fee for a card payment. I was unaware of these fees beforehand.,card_payment_fee_charged,train,20,2672
Why is there a fee associated with card use?,card_payment_fee_charged,train,20,2673
What is this fee showing up in my account for?,card_payment_fee_charged,train,20,2674
I got charged for with a fee for paying with my card.,card_payment_fee_charged,train,20,2675
Why am I being charged a fee on a card payment?,card_payment_fee_charged,train,20,2676
Is there a  way to  get around fees,card_payment_fee_charged,train,20,2677
I noticed an extra fee when I paid with my card.,card_payment_fee_charged,train,20,2678
You advertise no fee when paying with a card then my statement shows a fee.,card_payment_fee_charged,train,20,2679
"There was an extra fee when I paid with my card, why was i charged this extra fee?",card_payment_fee_charged,train,20,2680
Why was there an additional fee on the payment I just made? I don't usually have additional fees applied to my payments.,card_payment_fee_charged,train,20,2681
what is this extra charge with my purchase?,card_payment_fee_charged,train,20,2682
Hello! I randomly got charged an extra fee today as i was shopping online and i have no idea why! Are there extra fees for card payments? Or am i missing something here?,card_payment_fee_charged,train,20,2683
Please explain the extra fee when I paid with the card.,card_payment_fee_charged,train,20,2684
When do you charge fees on accounts? I just saw a charge on my statement.,card_payment_fee_charged,train,20,2685
After I used my card I saw I was charged a fee for using it,card_payment_fee_charged,train,20,2686
Is there an allowance on cards?,card_payment_fee_charged,train,20,2687
Why am I being charged a hidden fee?,card_payment_fee_charged,train,20,2688
Can you explain why I was charged extra when I used the card?,card_payment_fee_charged,train,20,2689
Why did I get charged a fee on my card?,card_payment_fee_charged,train,20,2690
Do you have charges now when you pay with a card?,card_payment_fee_charged,train,20,2691
What is the extra fee that was added when I used the card?,card_payment_fee_charged,train,20,2692
Why am I charged a fee for using my card on some purchases?,card_payment_fee_charged,train,20,2693
Why am I being charged a fee for using my card? If there is some print out of places that charge me can you please send me that?,card_payment_fee_charged,train,20,2694
How can I tell if there will be a fee added to my payment or not?,card_payment_fee_charged,train,20,2695
You promised no fees but now I've got one. What the hell!?,card_payment_fee_charged,train,20,2696
How do I know which payments I make will have additional fees? Where can I find this information online?,card_payment_fee_charged,train,20,2697
I am worried that too much time has gone by for a transfer to be completed.,transfer_not_received_by_recipient,train,21,2698
What is the time frame that it usually takes for a transfer to come through? I have a friend needing it immediately but it has yet to come through.,transfer_not_received_by_recipient,train,21,2699
My money transaction can't be seen by the person I sent it to,transfer_not_received_by_recipient,train,21,2700
"How long does it typically take a transfer to go through?  I sent some money to a friend earlier today, and she really needs it.  It still is a pending transfer, even though I sent it a few hours ago.",transfer_not_received_by_recipient,train,21,2701
"I have done a transfer within the country the day before yesterday, but it's still not there yet. Can you please check what's going on with that, the account number definitely is the right one, I've checked that already.",transfer_not_received_by_recipient,train,21,2702
"I have done a transfer within the country the day before yesterday, but it's still not there yet. Can you please check what's going on with that, the account number is the right one, I've checked that several times already.",transfer_not_received_by_recipient,train,21,2703
My money transaction hasn't arrived.,transfer_not_received_by_recipient,train,21,2704
I sent money to a person and they haven't received the payment yet.,transfer_not_received_by_recipient,train,21,2705
I do not know where the transaction is.,transfer_not_received_by_recipient,train,21,2706
I transferred money but the recipient does not see the funds in their account?,transfer_not_received_by_recipient,train,21,2707
why hasn't a transaction to a friend cleared yet?,transfer_not_received_by_recipient,train,21,2708
The app isn't showing my transactions,transfer_not_received_by_recipient,train,21,2709
Why isn't the recipient seeing the transaction? I just sent the money.,transfer_not_received_by_recipient,train,21,2710
I transferred money and it didn't get there.,transfer_not_received_by_recipient,train,21,2711
Is there a reason why a recipient might not see my money transaction,transfer_not_received_by_recipient,train,21,2712
I don't see the transaction I made to a friend on my account.,transfer_not_received_by_recipient,train,21,2713
why has a transaction to a friend been delayed?,transfer_not_received_by_recipient,train,21,2714
"A transaction I did to my friend hasn't arrived yet, why?",transfer_not_received_by_recipient,train,21,2715
Where is my last money transaction,transfer_not_received_by_recipient,train,21,2716
I am having an issue with an in country transfer I did a few days ago. It has yet to appear in my account. I have checked to be sure that all account information is correct multiple times. What is taking the transfer so long?,transfer_not_received_by_recipient,train,21,2717
I made a transfer the day before yesterday within this country. It is still not showing up at all. I have double-checked and the account number is certainly right. I've actually type this multiple times. can you look into what is going on here?,transfer_not_received_by_recipient,train,21,2718
How much time do transfers typically take? I sent money to a friend who needs it urgently. It's been hours and has not gone through.,transfer_not_received_by_recipient,train,21,2719
A transaction to a friend still hasn't shown up.,transfer_not_received_by_recipient,train,21,2720
I sent money and the recipient has not received their money after two weeks.,transfer_not_received_by_recipient,train,21,2721
How long will it take for my transfer to arrive?,transfer_not_received_by_recipient,train,21,2722
Why did the funds not transfer to another recipient?,transfer_not_received_by_recipient,train,21,2723
I sent a payment but it isn't showing up in the app,transfer_not_received_by_recipient,train,21,2724
I tried to transfer some money and it hasn't done it yet - what's going on?,transfer_not_received_by_recipient,train,21,2725
I made a transfer and they haven't received the money I sent them.,transfer_not_received_by_recipient,train,21,2726
"how long does it take to transfer money, my retailer is waiting",transfer_not_received_by_recipient,train,21,2727
"I sent money to someone but they haven't gotten it, what's going on?",transfer_not_received_by_recipient,train,21,2728
"How long does it take for transfers to process?  I sent funds to a friend, and she says that she has not yet received anything.",transfer_not_received_by_recipient,train,21,2729
Why hasn't the transaction I did to my friend arrive yet?,transfer_not_received_by_recipient,train,21,2730
I sent money about 5 days ago and the recipient has not received the money yet.,transfer_not_received_by_recipient,train,21,2731
I am just waiting on the completion of the transaction.,transfer_not_received_by_recipient,train,21,2732
My cash transaction isn't showing on my account,transfer_not_received_by_recipient,train,21,2733
Why hasn't my transaction arrived?,transfer_not_received_by_recipient,train,21,2734
When are you going to transfer the money?,transfer_not_received_by_recipient,train,21,2735
"I have moved to a new house and set up a rent payment to my landlord, it was supposed to be in her account a few days ago but it hasn't arrived.  I definitely sent it to the right place, can you confirm where the money is?",transfer_not_received_by_recipient,train,21,2736
I need to check status as my friend hasn't got money I sent.,transfer_not_received_by_recipient,train,21,2737
How long do transfers typically take? Is there a way of speeding the process up? My friend needs the money I sent her desperately.,transfer_not_received_by_recipient,train,21,2738
wheres my money receipt,transfer_not_received_by_recipient,train,21,2739
Money is not in recipients account.,transfer_not_received_by_recipient,train,21,2740
How long does it take for money to transfer?  I sent some to a friend and it hasn't gone through yet.,transfer_not_received_by_recipient,train,21,2741
Why hasn't the transaction I did to my friend arrived yet?,transfer_not_received_by_recipient,train,21,2742
"How much time do transfers take? I sent money to a friend who needs it fast. It's been hours, and the money has not gone through.",transfer_not_received_by_recipient,train,21,2743
"How long should a transfer normally take to process completely? I have a friend that needs it right away, but it's already been 2 hours and she hasn't received it.",transfer_not_received_by_recipient,train,21,2744
My friend says he hasn't received my transaction,transfer_not_received_by_recipient,train,21,2745
What is the length of a transaction completion?,transfer_not_received_by_recipient,train,21,2746
I transferred some cash and it has not arrived yet.,transfer_not_received_by_recipient,train,21,2747
I need to transfer some money to a friend who is in urgent need of some fast cash. How long will it take before she can use that money?,transfer_not_received_by_recipient,train,21,2748
Two days ago I did a transfer to another account within the country.  It doesn't appear the transfer went through.  I have verified the account number several times.  Could you please check on this for me?,transfer_not_received_by_recipient,train,21,2749
Where did the money transfer go?,transfer_not_received_by_recipient,train,21,2750
When will the transaction be done?,transfer_not_received_by_recipient,train,21,2751
I transferred some money to my mom 2 days ago and she has not received it. I double checked the information and it looks right. Can you help me?,transfer_not_received_by_recipient,train,21,2752
Why is it taking so long for a transfer to complete!,transfer_not_received_by_recipient,train,21,2753
Why is my transfer taking so long to complete?,transfer_not_received_by_recipient,train,21,2754
I am just waiting for the transaction to be completed.,transfer_not_received_by_recipient,train,21,2755
How long do I have  to wait for my transaction to be completed?,transfer_not_received_by_recipient,train,21,2756
I did a money transaction and the recipient doesn't see it,transfer_not_received_by_recipient,train,21,2757
Why hasn't my friend received the money i sent them yet?,transfer_not_received_by_recipient,train,21,2758
I sent money for my rent to my landlord but she is claiming it hasn't arrived in her account  Can you trace the transfer I made to make sure it arrived so I can provide proof I sent it and that it has been deposited?,transfer_not_received_by_recipient,train,21,2759
Why didn't my friend's transaction arrive yet?,transfer_not_received_by_recipient,train,21,2760
Still waiting for transfer to be completed.,transfer_not_received_by_recipient,train,21,2761
I transferred some money but it is not here yet,transfer_not_received_by_recipient,train,21,2762
What do I do if I completed a money transfer but the recipient hasn't received it?,transfer_not_received_by_recipient,train,21,2763
"I have done a transfer within the country a couple days ago, but it's still not there yet. Can you please check what's going on with that, the account number definitely is the right one, I've checked that several times already.",transfer_not_received_by_recipient,train,21,2764
I'm still waiting for my transaction.,transfer_not_received_by_recipient,train,21,2765
Why hasn't a transaction I did to my friend arrived yet?,transfer_not_received_by_recipient,train,21,2766
I set up a payment to a new payee and sent some money but the person I'm sending it to has not received it.  Can you check where the money is?,transfer_not_received_by_recipient,train,21,2767
My new landlord says he hasn't received the rent payment that I transferred a couple days ago. I've already checked the account numbers and they are correct. Can you tell me what's going on with this transaction that the transfer isn't showing up on my landlord's end?,transfer_not_received_by_recipient,train,21,2768
"I can't see if the transfer I did a couple days ago is in my account yet. I double checked my info before sending, too. Can you check this?",transfer_not_received_by_recipient,train,21,2769
My transfer has not arrived.,transfer_not_received_by_recipient,train,21,2770
How long does it take for the transfer to go through?,transfer_not_received_by_recipient,train,21,2771
What happens when I money transaction doesn't show up on the receiving side?,transfer_not_received_by_recipient,train,21,2772
"I'm trying to make a payment to my new landlord. Even though the payment was sent a few days ago, it isn't clearing on their side. Can you verify that payment has been made?",transfer_not_received_by_recipient,train,21,2773
"i've waited 2 days for a transfer to reach a retailers account, am i going to have to wait longer.",transfer_not_received_by_recipient,train,21,2774
my friend has not got the money I sent last week.,transfer_not_received_by_recipient,train,21,2775
Why can't the person I sent the money transfer to see it?,transfer_not_received_by_recipient,train,21,2776
The money has not yet been placed in recipients account.,transfer_not_received_by_recipient,train,21,2777
I'm getting concerned here.  I sent a friend some money and she isn't seeing it.  What's going on?,transfer_not_received_by_recipient,train,21,2778
I completed I transfer the day before yesterday in this country. The transfer still is not complete. I've checked on the account number multiple times to make sure that it is the right one. Can you check to see what's going on with this?,transfer_not_received_by_recipient,train,21,2779
"I made a transfer for my rent payment about 2 days ago, but my landlord hasn't received it yet. It shows as done on my  side, and I've double check all account numbers and they are correct. Can you verify that the transaction was actually made?",transfer_not_received_by_recipient,train,21,2780
Why hasn't arrived yet a transaction I did to my friend?,transfer_not_received_by_recipient,train,21,2781
I'm waiting for my transaction to complete.,transfer_not_received_by_recipient,train,21,2782
Why hasn't my friend received the transaction?,transfer_not_received_by_recipient,train,21,2783
I transferred money and it hasn't come yet,transfer_not_received_by_recipient,train,21,2784
Why hasn't my son received the transfer I sent to him earlier?,transfer_not_received_by_recipient,train,21,2785
How long do money transfers take? My friend really needs the money i sent a couple of hours ago but it's not there yet.,transfer_not_received_by_recipient,train,21,2786
Why hasn't the money transfer arrived yet?,transfer_not_received_by_recipient,train,21,2787
I have not received the completed transaction.,transfer_not_received_by_recipient,train,21,2788
how long does it take for a transfer to arrive,transfer_not_received_by_recipient,train,21,2789
How come my money hasn't shown up yet?,transfer_not_received_by_recipient,train,21,2790
"Hello, a few days ago I transferred my rent check to my landlord, however, he is saying that it has not gone though. On my end everything looks fine and I double checked the account number. Is there anything else that could be holding up the check?",transfer_not_received_by_recipient,train,21,2791
Why can't the recepient of my money transaction see it?,transfer_not_received_by_recipient,train,21,2792
The recipient doesn't see the money transaction I made,transfer_not_received_by_recipient,train,21,2793
How long will my transaction take?,transfer_not_received_by_recipient,train,21,2794
How long should it take for a transfer to go through? I have been waiting a while.,transfer_not_received_by_recipient,train,21,2795
"i accidentally entered in my retailers information, what should i do next",transfer_not_received_by_recipient,train,21,2796
I transferred some cash and it didn't arrive,transfer_not_received_by_recipient,train,21,2797
where has my transferred money gone?,transfer_not_received_by_recipient,train,21,2798
I tried doing an in country transfer earlier this week. I thought it would be there by now but I still don't see the money. Can you check the status on my transfer?,transfer_not_received_by_recipient,train,21,2799
Is there a reason a payment is showing complete on my side but the person who is receiving it has not gotten it?,transfer_not_received_by_recipient,train,21,2800
