text,category,set,category_id,id
"The ATM would not give me cash,why?",declined_cash_withdrawal,train,39,4943
My ATM transaction was cancelled.,declined_cash_withdrawal,train,39,4944
I was denied cash at an ATM,declined_cash_withdrawal,train,39,4945
I was not able to use the ATM to get cash,declined_cash_withdrawal,train,39,4946
Why did I get declined when trying to get cash?,declined_cash_withdrawal,train,39,4947
The ATM keeps declining my card! I tried two different ATMs already can you please check if everything is alright with my account??,declined_cash_withdrawal,train,39,4948
Why wouldn't the ATM give me my money?,declined_cash_withdrawal,train,39,4949
Why are my withdrawals suddenly being declined?,declined_cash_withdrawal,train,39,4950
Can you tell me why I was declined from getting cash?,declined_cash_withdrawal,train,39,4951
Why couldn't I make a withdrawal from the ATM?,declined_cash_withdrawal,train,39,4952
Why is my ATM cash withdrawal not working?,declined_cash_withdrawal,train,39,4953
Is my card broken? I can't get cash out of the ATM,declined_cash_withdrawal,train,39,4954
I went to the Notting Hill ATM to use my card the first time for a cash withdrawal but it didn't work. Does this mean that my card isn't working yet?,declined_cash_withdrawal,train,39,4955
i tried to withdraw money but was told i didn't have funds,declined_cash_withdrawal,train,39,4956
The ATM keeps declining my Transaction . I tried two different ATMs already can you please check if everything is okay with my account?,declined_cash_withdrawal,train,39,4957
"Please double check my card - withdrawal was working fine so far, but this morning on the way to work it suddenly got declined!",declined_cash_withdrawal,train,39,4958
I was declined when trying to withdrawal cash!,declined_cash_withdrawal,train,39,4959
I needed cash from the ATM but I couldn't get it.,declined_cash_withdrawal,train,39,4960
My ATM withdrawal was declined.,declined_cash_withdrawal,train,39,4961
"When I went to get cash, it was declined!",declined_cash_withdrawal,train,39,4962
"Is my card working? It's the first time I tried using it I tried to get money out of an ATM, but got nothing.",declined_cash_withdrawal,train,39,4963
The ATM machines keep declining my card and I don't know why. I thought I had money in my account. Why is this happening?,declined_cash_withdrawal,train,39,4964
Why was my withdrawal requested cancelled by the ATM?,declined_cash_withdrawal,train,39,4965
I have tried using my card for the first time at the ATM of Notting Hill to withdrawal cash but it didn't work. Does this mean my card isn't working?,declined_cash_withdrawal,train,39,4966
A withdraw I tried to make at the ATM was declined I don't know why.,declined_cash_withdrawal,train,39,4967
Tried using my ATM card earlier at one of your locations for the first time.  It didn't work.  What is going on?,declined_cash_withdrawal,train,39,4968
Why can't I take money from my account?,declined_cash_withdrawal,train,39,4969
"This morning I wanted to make a withdrawal before work, but my card was declined! Please double check it for me as this is the first time it was declined.",declined_cash_withdrawal,train,39,4970
Why was I declined from getting cash?,declined_cash_withdrawal,train,39,4971
"I tried to get money out of the Notting Hill ATM earlier, but wasn't able to. Is my card working okay? It's the first time I tried using it.",declined_cash_withdrawal,train,39,4972
My ATM card isn't working for a withdrawl,declined_cash_withdrawal,train,39,4973
Is my card actually working? It's the first time I tried using it,declined_cash_withdrawal,train,39,4974
Is there a reason why my card was declined when I attempted to withdraw money?,declined_cash_withdrawal,train,39,4975
Is the ATM broken? I can't get cash from it.,declined_cash_withdrawal,train,39,4976
what is my monthly spending limit because i was refused my money at an atm,declined_cash_withdrawal,train,39,4977
I can't get cash from the ATM!,declined_cash_withdrawal,train,39,4978
"When I tried to access my cash, I wasn't allowed!",declined_cash_withdrawal,train,39,4979
"My card has been declined by two separate ATM, and I'm worried something is wrong with my account. Would you please see if my account is okay?",declined_cash_withdrawal,train,39,4980
Has my account been frozen?  I tried to use my card but the ATM would not dispense cash.,declined_cash_withdrawal,train,39,4981
I tried to withdraw cash from the ATM machine and it did not work. Can you tell me why?,declined_cash_withdrawal,train,39,4982
ATM withdrawal not working.,declined_cash_withdrawal,train,39,4983
I tried using my ATM card at your Notting Hill location today.  It did not work.  Am I doing something wrong?,declined_cash_withdrawal,train,39,4984
"I tried to get money out of an ATM in Notting Hill earlier, but it didn't work. Is my card actually working? It's the first time I tried using it",declined_cash_withdrawal,train,39,4985
I cannot withdraw money from the ATM,declined_cash_withdrawal,train,39,4986
My withdrawal from the ATM was cancelled.,declined_cash_withdrawal,train,39,4987
I'm trying to take money from my account but its not letting me. Help!,declined_cash_withdrawal,train,39,4988
Why won't the ATM let me withdraw money?,declined_cash_withdrawal,train,39,4989
My cash withdrawal was declined.  Why?,declined_cash_withdrawal,train,39,4990
Why couldn't I get cash from an ATM?,declined_cash_withdrawal,train,39,4991
I attempted to get cash in the ATM but it was not authorized,declined_cash_withdrawal,train,39,4992
Is there something wrong with my ATM Card?  Tried using it earlier and it did not work.,declined_cash_withdrawal,train,39,4993
The ATM keeps rejecting my Payment. I tried two different ATMs but did not work .Can you please check if everything is okay with my account?,declined_cash_withdrawal,train,39,4994
Why can't I withdraw cash from this ATM?,declined_cash_withdrawal,train,39,4995
I was getting some cash out of the ATM but it cancelled on me without warning.,declined_cash_withdrawal,train,39,4996
I wasn't able to withdraw money at an ATM,declined_cash_withdrawal,train,39,4997
Why can't I withdraw funds from my account?,declined_cash_withdrawal,train,39,4998
I tried to get cash in the ATM but it was not approved,declined_cash_withdrawal,train,39,4999
My card rejected a cash withdrawal. Why?,declined_cash_withdrawal,train,39,5000
Why was my cash withdrawal declined by the ATM?,declined_cash_withdrawal,train,39,5001
I could not get the ATM to work,declined_cash_withdrawal,train,39,5002
totally unacceptable.  I'm stranded with no cash because the ATM wouldn't give me any money!,declined_cash_withdrawal,train,39,5003
Help! My card isn't working at the ATM and I know I used the right PIN. Trying to get my money.,declined_cash_withdrawal,train,39,5004
I tried to pull cash from an ATM but it wouldn't let me.,declined_cash_withdrawal,train,39,5005
"I tried to get money out of the Notting Hill ATM earlier, but I wasn't able to get it to work. Is my card with issue? It's the first time I tried using it.",declined_cash_withdrawal,train,39,5006
Can you please tell me why I cant get money from the ATM?,declined_cash_withdrawal,train,39,5007
"How do I get money from an ATM using my card? I can't seem to get it to work? I used the pin I had, but maybe it's wrong? What do I need to do to fix this?",declined_cash_withdrawal,train,39,5008
"Hello, is there any way to double check my card? I have never had issues with withdraws in the past, but this morning on the way to work it was unexpectedly declined.",declined_cash_withdrawal,train,39,5009
My card didn't work at the ATM in Notting Hill.  Is my card working?,declined_cash_withdrawal,train,39,5010
Why am I not able to get cash from the ATM?,declined_cash_withdrawal,train,39,5011
my card was frozen due to putting in the wrong pin too much.  how many tries do i have,declined_cash_withdrawal,train,39,5012
I cant get money out of the ATM with my card.  I just put my card in the ATM but it will not allow me to take any money out.  What do I need to do to fix this?,declined_cash_withdrawal,train,39,5013
Why was I not able to take cash from the ATM?,declined_cash_withdrawal,train,39,5014
"Would you please check my Card. As Withdrawal was working fine so far, but this morning suddenly got declined. Can you please check the problem?",declined_cash_withdrawal,train,39,5015
Why would the ATM machine fail to give me the cash withdrawal I requested?,declined_cash_withdrawal,train,39,5016
I am having trouble withdrawing cash.,declined_cash_withdrawal,train,39,5017
Why is the ATM not allowing me to get cash?,declined_cash_withdrawal,train,39,5018
Why can I not take out cash?,declined_cash_withdrawal,train,39,5019
I tried to get cash but it was declined!,declined_cash_withdrawal,train,39,5020
"Hi, I am unable to use my card in ATM. I had tried my card in two ATMs but both ATMs declined it. Could you please check my account?",declined_cash_withdrawal,train,39,5021
The ATM won't let me take out cash,declined_cash_withdrawal,train,39,5022
I'm not able to withdraw money from the ATM but I'm not sure why.,declined_cash_withdrawal,train,39,5023
why wouldnt the atm give me money,declined_cash_withdrawal,train,39,5024
"My cash withdrawal was declined, why?",declined_cash_withdrawal,train,39,5025
"I think there may be something wrong with my card. I have never had issues with withdraws before, but this morning on the way to work it was suddenly declined.",declined_cash_withdrawal,train,39,5026
Why can I not get cash from the ATM?,declined_cash_withdrawal,train,39,5027
Why was I not able to get cash from the ATM?,declined_cash_withdrawal,train,39,5028
My card doesn't work. I can't get cash out at an ATM,declined_cash_withdrawal,train,39,5029
Why am I not able to withdraw cash from this ATM?,declined_cash_withdrawal,train,39,5030
Why can't I withdraw money?,declined_cash_withdrawal,train,39,5031
The atm wouldn't give out cash,declined_cash_withdrawal,train,39,5032
What caused my cash withdrawal to be declined?,declined_cash_withdrawal,train,39,5033
Why wont the ATM give me cash?,declined_cash_withdrawal,train,39,5034
Why do I get declined when I try to withdraw cash?,declined_cash_withdrawal,train,39,5035
What was the cause for my card to be declined?,declined_cash_withdrawal,train,39,5036
The ATM cancelled a transaction on me when I was trying to get some cash out.,declined_cash_withdrawal,train,39,5037
Why can't I get cash from the ATM?,declined_cash_withdrawal,train,39,5038
atm refused to give me money,declined_cash_withdrawal,train,39,5039
I was declined when I tried to withdraw cash!,declined_cash_withdrawal,train,39,5040
I couldn't get money from the ATM,declined_cash_withdrawal,train,39,5041
I tried to use the ATM today but it would not accept my card.,declined_cash_withdrawal,train,39,5042
The ATM wouldn't let me withdraw cash.,declined_cash_withdrawal,train,39,5043
"I tried to get money out of the Notting Hill ATM earlier, but I wasn't able to get anything out. Is there a problem with my card? It's the first time I tried using it.",declined_cash_withdrawal,train,39,5044
Please help me with my card. As i have tried to use my card in two different ATMs but repeatedly it was declining by ATM.,declined_cash_withdrawal,train,39,5045
The ATM wouldn't allow me to withdraw money,declined_cash_withdrawal,train,39,5046
Why am I unable to withdraw my money through this card?,declined_cash_withdrawal,train,39,5047
Is there a problem with my account? When I tried to withdraw cash at an ATM I was denied.,declined_cash_withdrawal,train,39,5048
ATM apparently not working?  Couldn't access funds in my account?,declined_cash_withdrawal,train,39,5049
Why is my card being declined at the ATM? I have tried multiple ATMs and i keep running into the same problem. Could you verify that everything is okay with my account?,declined_cash_withdrawal,train,39,5050
The ATM wouldn't let me have my money.,declined_cash_withdrawal,train,39,5051
I tired to get cash in the ATM but it was cancelled,declined_cash_withdrawal,train,39,5052
Is there something wrong with the ATM? It would not let me pull cash out of my account.,declined_cash_withdrawal,train,39,5053
"Hi, In morning, i was trying to withdraw money from my card, but it got declined. So far it was working fine. Could you please check my card.",declined_cash_withdrawal,train,39,5054
When going to the ATM to take out some cash today my withdrawal was  declined.  I need to fix this problem as soon as possible. whats going on?,declined_cash_withdrawal,train,39,5055
I can't get any money from my account.,declined_cash_withdrawal,train,39,5056
"I tried to withdraw cash, but got declined!",declined_cash_withdrawal,train,39,5057
"The ATM will not let me get cash, WHY?",declined_cash_withdrawal,train,39,5058
I can't withdraw any money from my account. Ive tried a couple different ATM machines and both of them wouldn't give me my money. What's going on? Is my account frozen or something?,declined_cash_withdrawal,train,39,5059
Why was my atm withdrawl declined,declined_cash_withdrawal,train,39,5060
why would i be declined if i had money iin my account,declined_cash_withdrawal,train,39,5061
Why was my cash withdrawal cancelled at the ATM?,declined_cash_withdrawal,train,39,5062
Why can't I withdraw cash?,declined_cash_withdrawal,train,39,5063
Why am I unable to withdrawal cash?,declined_cash_withdrawal,train,39,5064
I just had my card get declined at the ATM! I need to get money out but I am unable to.  Why has this happened?,declined_cash_withdrawal,train,39,5065
I entered the correct pin but I still couldnt get funds.,declined_cash_withdrawal,train,39,5066
My card wont work at an ATM,declined_cash_withdrawal,train,39,5067
"Why does the ATM continually decline my card? I've tried multiple times on different machines with the same results. I thought I had enough funds for this, so please help me understand why this is happening.",declined_cash_withdrawal,train,39,5068
i entered my pin in wrong and got it frozen. how many tries do i have,declined_cash_withdrawal,train,39,5069
This is the first time I've tried to get my money out of an ATM and it didn't work. Please give me my money,declined_cash_withdrawal,train,39,5070
Why am I having trouble withdrawing cash?,declined_cash_withdrawal,train,39,5071
"I tried to make a withdrawal from the ATM, but it was cancelled.",declined_cash_withdrawal,train,39,5072
I could not get money from an ATM,declined_cash_withdrawal,train,39,5073
I think I am having an issue with withdraws on my card. It was declined on the way to work this morning. This hasn't happened in the past.,declined_cash_withdrawal,train,39,5074
I attempted to get money in cash but it was refused!,declined_cash_withdrawal,train,39,5075
My ATM withdrawal was cancelled,declined_cash_withdrawal,train,39,5076
I might need a new card because it's not working at any of the ATMs. I don't think ive used all my money. Why is it doing this?,declined_cash_withdrawal,train,39,5077
"Please check my Card. As Withdrawal was working fine so far, but this morning suddenly got declined. Can you please check the problem?",declined_cash_withdrawal,train,39,5078
"I tried to withdraw some funds from my card, but was declined. How can I get my money?",declined_cash_withdrawal,train,39,5079
I can't get the ATM to give me any cash,declined_cash_withdrawal,train,39,5080
I am unable to get cash from the ATM,declined_cash_withdrawal,train,39,5081
How come the ATM won't give me my money?,declined_cash_withdrawal,train,39,5082
I tried to withdraw cash from your ATM but my transaction was cancelled.,declined_cash_withdrawal,train,39,5083
Why did the ATM cancel my transaction,declined_cash_withdrawal,train,39,5084
Why wouldn't the ATM give me cash?,declined_cash_withdrawal,train,39,5085
Why wouldn't my withdrawal go through?,declined_cash_withdrawal,train,39,5086
I attempted to get cash in the ATM but I was denied,declined_cash_withdrawal,train,39,5087
The ATM didnt let me get cash,declined_cash_withdrawal,train,39,5088
Why am I unable to withdraw money even though in the past I've done it just fine?,declined_cash_withdrawal,train,39,5089
I was declined when I tried to take out cash!,declined_cash_withdrawal,train,39,5090
how come i was declined,declined_cash_withdrawal,train,39,5091
What does it mean when a payment is pending?,pending_card_payment,train,40,5092
Could you please tell me why my purchases from this morning say payment is pending?,pending_card_payment,train,40,5093
The purchase I made is still pending.,pending_card_payment,train,40,5094
Is there a problem with the payment that I see is still pending?,pending_card_payment,train,40,5095
There is a payment that I made that hasn't gone through yet.,pending_card_payment,train,40,5096
How long does it actually take for a card payment to go through? There's one stuck since a couple days already that doesn't seem to move,pending_card_payment,train,40,5097
Why does my payment appear as pending?,pending_card_payment,train,40,5098
How long does a payment usually show as pending? Is it normal that mine is still pending?,pending_card_payment,train,40,5099
Why is my payment in pending status?,pending_card_payment,train,40,5100
I have a card payment which shows as pending,pending_card_payment,train,40,5101
I made a payment with my card and it hasn't changed. How long do you think this will take?,pending_card_payment,train,40,5102
Why is the payment showing as pending from things I bought this morning?,pending_card_payment,train,40,5103
I made a card payment which is showing me pending.,pending_card_payment,train,40,5104
Why are my payments not working and show pending?,pending_card_payment,train,40,5105
"I put in a payment a while ago and it has still not cleared and is showing up as ""pending"", how long does it take to clear?",pending_card_payment,train,40,5106
Why are the things I bought earlier today still showing as pending?,pending_card_payment,train,40,5107
Card payment still pending.,pending_card_payment,train,40,5108
"My card payment is just showing up as pending since forever, what's going on with that, it should be going through at some point?",pending_card_payment,train,40,5109
I have a payment that has not gone through yet,pending_card_payment,train,40,5110
"I initiated a payment a while ago and it is still showing as ""pending"", how long will it take to clear?",pending_card_payment,train,40,5111
Why is my purchase showing as pending?,pending_card_payment,train,40,5112
How long will it take for my payment to go through?,pending_card_payment,train,40,5113
After making a payment with my card it doesn't seem to have worked. It's just showing to be pending. When will this actually be going through?,pending_card_payment,train,40,5114
"It says ""pending payment?"" Why is it saying this?",pending_card_payment,train,40,5115
Is there a reason my payments are pending?,pending_card_payment,train,40,5116
Why is my card payment still a pending transaction?,pending_card_payment,train,40,5117
"Card payment is still pending, why is that the case?",pending_card_payment,train,40,5118
I have been waiting for my card payment to be moved from pending status for an unusually long time.  What is going on here and do you have an idea of when I can expect it to go through?,pending_card_payment,train,40,5119
How come my card payment is still pending?,pending_card_payment,train,40,5120
I notice there's a pending payment on my card.,pending_card_payment,train,40,5121
How is my card payment still pending?,pending_card_payment,train,40,5122
Why is my card payment still pending?,pending_card_payment,train,40,5123
What does pending payment mean?,pending_card_payment,train,40,5124
Why is my payment still pending?,pending_card_payment,train,40,5125
What does it mean when it says that I have a payment that is pending?,pending_card_payment,train,40,5126
My card payment is showing pending however this transaction was a couple of days ago. Is there a reason why it it still pending?,pending_card_payment,train,40,5127
A card payment on my account is shown as pending.,pending_card_payment,train,40,5128
Why is their a charge pending on my card still?,pending_card_payment,train,40,5129
My card payment says pending and it hasn't changed,pending_card_payment,train,40,5130
Card payment is showing as pending,pending_card_payment,train,40,5131
What is the longest that a payment will show pending?  There is one showing that has been sitting there a few days.,pending_card_payment,train,40,5132
I tried to pay through my account but the payment is not going through. What's going on?,pending_card_payment,train,40,5133
Why is the payment on my card still pending?,pending_card_payment,train,40,5134
What's taking so long for this payment to go through?,pending_card_payment,train,40,5135
Why haven't I gotten my payment yet?,pending_card_payment,train,40,5136
It looks like a payment I've made hasn't made it through yet.,pending_card_payment,train,40,5137
My card payment has had the status of pending forever. What is the issue? It should have gone through at some point.,pending_card_payment,train,40,5138
A payment is pending,pending_card_payment,train,40,5139
Why hasn't my card payment cleared yet?,pending_card_payment,train,40,5140
I've made a card payment a couple of days ago now but it looks like the money is stuck. How long does it typically take for the payment to go through?,pending_card_payment,train,40,5141
My payment is taking a long time to go through.,pending_card_payment,train,40,5142
What does it mean if my payment is pending?,pending_card_payment,train,40,5143
When will my payment go through?,pending_card_payment,train,40,5144
My card payment still pending,pending_card_payment,train,40,5145
How long does a payment show as pending before i should worry about it?,pending_card_payment,train,40,5146
Why is my card payment pending?,pending_card_payment,train,40,5147
I made a card payment by my card but it failed. Please let me know when the payment will get completed as its still pending.,pending_card_payment,train,40,5148
"Hi, status of one of my card payment is still pending from a while. Please let e know how much time it will take to complete.",pending_card_payment,train,40,5149
"After I make a payment, how long will it be before it transitions from ""pending"" to complete?",pending_card_payment,train,40,5150
"My card payment is showing up as pending for a very long time, what's going on with that, it should be going through at some point?",pending_card_payment,train,40,5151
My purchases from this morning are showing up as payment pending. Can you tell me why?,pending_card_payment,train,40,5152
There is a payment that has not processed.,pending_card_payment,train,40,5153
I'm still waiting on a payment,pending_card_payment,train,40,5154
I need to find out why my pending payment hasn't gone through.,pending_card_payment,train,40,5155
I am waiting for a payment to be processed,pending_card_payment,train,40,5156
I don't understand why my card payment is pending.  It has been pending for too long.  Why is this and when might it go through?,pending_card_payment,train,40,5157
"I did a payment with my card but seem that didn't work, it's still listed as pending since a while ago. When does this actually go through?",pending_card_payment,train,40,5158
I need to know when a payment will actually go through. I completed a payment using my card but it is just showing as pending at this point and it has been a while ago.,pending_card_payment,train,40,5159
When will the transaction go through?,pending_card_payment,train,40,5160
My card payment has been stuck on pending. What is the problem? It should have gone through by now.,pending_card_payment,train,40,5161
Why is the purchase I made this morning still pending?,pending_card_payment,train,40,5162
A transaction on my card shows as pending.,pending_card_payment,train,40,5163
I have a pending payment on my card.  Why?,pending_card_payment,train,40,5164
I have a card payment that has been pending for some time and would like to know when it is going to go through.,pending_card_payment,train,40,5165
"I made a payment a while ago and it is still showing as ""pending"" in the account. How long will this payment take to complete?",pending_card_payment,train,40,5166
What does a 'pending payment' mean?,pending_card_payment,train,40,5167
"Hello, I made a payment with my card and it's not working. It's been a while and still says its pending. Can you tell when this will go through?",pending_card_payment,train,40,5168
"Hi,  One of payment is still coming as pending for which i have already paid by card. I guess it did not processed, could you please check and update me.",pending_card_payment,train,40,5169
My purchase from this morning still is pending.,pending_card_payment,train,40,5170
Why is my card payment still listed as pending?,pending_card_payment,train,40,5171
One of my card payments looks like it's stuck but I have made the payment days ago. How long until the payment will be applied to my account?,pending_card_payment,train,40,5172
I don't know what pending transaction means.,pending_card_payment,train,40,5173
"My card payment is just showing up as pending since forever, what's going on with that, when should it be going through?",pending_card_payment,train,40,5174
It says pending status for my payment. Why?,pending_card_payment,train,40,5175
pending transaction?,pending_card_payment,train,40,5176
I noticed that there's a payment on my card that's pending.,pending_card_payment,train,40,5177
When is a payment I made with my card going to clear>,pending_card_payment,train,40,5178
My card payment has been pending for a long time now. Why is it taking so long to take. It should have already made it through.,pending_card_payment,train,40,5179
What does it mean if it says that my payment is pending?,pending_card_payment,train,40,5180
